{
  "schema_version": 1,
  "catalog_version": "1.0",
  "target_theme": {"id": "calinium-one", "version": "1.0"},
  "presets": [
    {
      "id": "atelier",
      "name": "Atelier",
      "version": "1.0",
      "status": "active",
      "merchant_fit": ["craft-led brands", "leather goods", "artisan home goods", "verified traditional production", "premium food with verified process evidence"],
      "compatible_industries": ["luxury_fashion", "jewelry", "furniture", "home", "food_beverage"],
      "compatible_business_models": ["direct_to_consumer", "retail", "wholesale"],
      "compatible_personalities": ["traditional", "warm", "sophisticated", "luxury", "confident"],
      "compatible_design_languages": ["artisan", "heritage", "editorial", "luxury"],
      "compatible_recipes": ["luxury_story", "food_story", "editorial_discovery"],
      "homepage_recipe": "luxury_story",
      "page_blueprints": ["homepage", "about", "product", "collection", "article"],
      "global_settings": [
        {"setting_id": "heading_scale", "value": 115},
        {"setting_id": "body_scale", "value": 100},
        {"setting_id": "page_width", "value": 1320},
        {"setting_id": "content_width", "value": 720},
        {"setting_id": "section_spacing", "value": 112},
        {"setting_id": "grid_gap", "value": 32},
        {"setting_id": "enable_motion", "value": true},
        {"setting_id": "motion_duration", "value": 250},
        {"setting_id": "button_radius", "value": 2},
        {"setting_id": "card_radius", "value": 2},
        {"setting_id": "media_radius", "value": 2}
      ],
      "section_defaults": [
        {"section_id": "full-screen-hero", "settings": [{"setting_id": "content_width", "value": "narrow"}, {"setting_id": "text_alignment", "value": "left"}, {"setting_id": "autoplay", "value": false}, {"setting_id": "enable_animation", "value": true}]},
        {"section_id": "craftsmanship", "settings": [{"setting_id": "image_ratio", "value": "portrait"}, {"setting_id": "text_alignment", "value": "left"}]},
        {"section_id": "manufacturing-process", "settings": [{"setting_id": "columns_desktop", "value": "3"}, {"setting_id": "text_alignment", "value": "left"}]},
        {"section_id": "featured-collection", "settings": [{"setting_id": "desktop_columns", "value": "3"}, {"setting_id": "image_ratio", "value": "portrait"}]}
      ],
      "typography_direction": "refined_editorial",
      "spacing_direction": "spacious",
      "color_system_intent": "warm_tactile",
      "imagery_treatment": "tactile_editorial",
      "information_density": "low",
      "merchandising_emphasis": "restrained",
      "content_requirements": [
        {"id": "hero_media", "kind": "approved_asset", "level": "required", "sections": ["full-screen-hero"]},
        {"id": "craft_evidence", "kind": "verified_evidence", "level": "recommended", "sections": ["craftsmanship", "manufacturing-process", "materials"]},
        {"id": "founder_evidence", "kind": "verified_evidence", "level": "optional", "sections": ["founder-story"]},
        {"id": "verified_testimonials", "kind": "verified_evidence", "level": "optional", "sections": ["testimonials"]}
      ],
      "supported_adapters": ["craftsmanship", "manufacturing-process"],
      "omission_priority": ["founder-story", "testimonials", "craftsmanship", "manufacturing-process", "materials"],
      "incompatibilities": ["unverified_handmade_claims", "unverified_heritage_claims", "unverified_origin_claims"],
      "performance_budget": {"maximum_homepage_sections": 7, "maximum_autoplay_sections": 0, "media_priority": "balanced"},
      "motion_policy": {"intensity": "subtle", "autoplay_default": false, "reduced_motion_required": true},
      "fallbacks": {"preset_id": "essential", "recipe": "beauty_discovery", "minimum_viable_sections": ["full-screen-hero", "featured-collection", "newsletter"]},
      "recommendation_priority": 75
    },
    {
      "id": "maison",
      "name": "Maison",
      "version": "1.0",
      "status": "active",
      "merchant_fit": ["luxury fashion", "jewelry", "accessories", "premium beauty", "fragrance", "design-led lifestyle"],
      "compatible_industries": ["luxury_fashion", "jewelry", "beauty", "wellness", "fashion"],
      "compatible_business_models": ["direct_to_consumer", "retail", "marketplace"],
      "compatible_personalities": ["luxury", "sophisticated", "minimal", "confident", "modern"],
      "compatible_design_languages": ["luxury", "editorial", "premium", "minimalist", "modern", "lifestyle"],
      "compatible_recipes": ["luxury_story", "beauty_discovery", "catalogue_first"],
      "homepage_recipe": "luxury_story",
      "page_blueprints": ["homepage", "product", "collection"],
      "global_settings": [
        {"setting_id": "heading_scale", "value": 120},
        {"setting_id": "body_scale", "value": 100},
        {"setting_id": "page_width", "value": 1440},
        {"setting_id": "content_width", "value": 720},
        {"setting_id": "section_spacing", "value": 120},
        {"setting_id": "grid_gap", "value": 28},
        {"setting_id": "enable_motion", "value": true},
        {"setting_id": "motion_duration", "value": 250},
        {"setting_id": "button_radius", "value": 0},
        {"setting_id": "card_radius", "value": 0},
        {"setting_id": "media_radius", "value": 0}
      ],
      "section_defaults": [
        {"section_id": "full-screen-hero", "settings": [{"setting_id": "content_width", "value": "narrow"}, {"setting_id": "text_alignment", "value": "left"}, {"setting_id": "autoplay", "value": false}]},
        {"section_id": "featured-collection", "settings": [{"setting_id": "desktop_columns", "value": "4"}, {"setting_id": "image_ratio", "value": "portrait"}, {"setting_id": "text_alignment", "value": "left"}]},
        {"section_id": "collection-carousel", "settings": [{"setting_id": "columns_desktop", "value": "4"}, {"setting_id": "image_ratio", "value": "portrait"}]},
        {"section_id": "product-carousel", "settings": [{"setting_id": "columns_desktop", "value": "4"}, {"setting_id": "image_ratio", "value": "portrait"}]}
      ],
      "typography_direction": "quiet_luxury",
      "spacing_direction": "generous",
      "color_system_intent": "quiet_premium",
      "imagery_treatment": "premium_product",
      "information_density": "low",
      "merchandising_emphasis": "collection_led",
      "content_requirements": [
        {"id": "premium_hero_media", "kind": "approved_asset", "level": "required", "sections": ["full-screen-hero"]},
        {"id": "collection_resource", "kind": "approved_resource", "level": "required", "sections": ["featured-collection", "collection-carousel"]},
        {"id": "campaign_media", "kind": "approved_asset", "level": "optional", "sections": ["lookbook"]},
        {"id": "verified_testimonials", "kind": "verified_evidence", "level": "optional", "sections": ["testimonials"]},
        {"id": "founder_evidence", "kind": "verified_evidence", "level": "optional", "sections": ["founder-story"]},
        {"id": "craft_evidence", "kind": "verified_evidence", "level": "optional", "sections": ["craftsmanship"]}
      ],
      "supported_adapters": ["lookbook"],
      "omission_priority": ["founder-story", "team", "awards-certifications", "testimonials", "lookbook"],
      "incompatibilities": ["unverified_testimonials", "invented_lifestyle_media", "required_founder_story"],
      "performance_budget": {"maximum_homepage_sections": 7, "maximum_autoplay_sections": 0, "media_priority": "product_led"},
      "motion_policy": {"intensity": "subtle", "autoplay_default": false, "reduced_motion_required": true},
      "fallbacks": {"preset_id": "essential", "recipe": "beauty_discovery", "minimum_viable_sections": ["full-screen-hero", "featured-collection", "newsletter"]},
      "recommendation_priority": 70
    },
    {
      "id": "gallery",
      "name": "Gallery",
      "version": "1.0",
      "status": "active",
      "merchant_fit": ["rugs", "furniture", "interiors", "art", "ceramics", "collectible objects", "photography-led brands"],
      "compatible_industries": ["furniture", "home", "fashion", "hospitality"],
      "compatible_business_models": ["direct_to_consumer", "retail", "booking_enquiry"],
      "compatible_personalities": ["sophisticated", "modern", "warm", "minimal"],
      "compatible_design_languages": ["editorial", "lifestyle", "modern", "artisan"],
      "compatible_recipes": ["editorial_discovery", "catalogue_first"],
      "homepage_recipe": "editorial_discovery",
      "page_blueprints": ["homepage", "collection", "article", "about"],
      "global_settings": [
        {"setting_id": "heading_scale", "value": 115},
        {"setting_id": "body_scale", "value": 100},
        {"setting_id": "page_width", "value": 1520},
        {"setting_id": "content_width", "value": 760},
        {"setting_id": "section_spacing", "value": 120},
        {"setting_id": "grid_gap", "value": 32},
        {"setting_id": "enable_motion", "value": true},
        {"setting_id": "motion_duration", "value": 250},
        {"setting_id": "media_radius", "value": 0}
      ],
      "section_defaults": [
        {"section_id": "lookbook", "settings": [{"setting_id": "layout", "value": "feature-first"}, {"setting_id": "text_alignment", "value": "left"}]},
        {"section_id": "editorial-grid", "settings": [{"setting_id": "desktop_columns", "value": "3"}, {"setting_id": "media_ratio", "value": "portrait"}, {"setting_id": "text_alignment", "value": "left"}]},
        {"section_id": "featured-collection", "settings": [{"setting_id": "desktop_columns", "value": "3"}, {"setting_id": "image_ratio", "value": "portrait"}]}
      ],
      "typography_direction": "gallery_editorial",
      "spacing_direction": "editorial",
      "color_system_intent": "neutral_gallery",
      "imagery_treatment": "large_editorial",
      "information_density": "medium",
      "merchandising_emphasis": "visual_discovery",